{
  "id": "https://untp.unece.org/registers/swi",
  "name": "UNTP Software Implementers Register",
  "description": "A directory of software solutions that have committed to implementing the UN Transparency Protocol (UNTP). Each entry provides organisation metadata, product information, UNTP scope, and links to conformity test results from the UNTP test playground.",
  "lastUpdated": "2026-03-13",
  "registrar": {
    "id": "https://unece.org",
    "name": "United Nations Economic Commission for Europe (UNECE)"
  },
  "entries": [
    {
      "id": "https://untp.unece.org/registers/swi/uncefact",
      "name": "UNCEFACT",
      "website": "https://unece.org/trade/uncefact",
      "description": "The UN center for trade facilitation and e-business (UN/CEFACT) provides a suite of UNTP open source reference implementations and a conformity testing toolkit to support global implementers of UNTP.",
      "registrationCountry": "Switzerland",
      "operatingCountries": "Global",
      "commitmentDate": "2024-09-01",
      "pilotParticipation": true,
      "untpScope": [
        "VCP",
        "DPP",
        "DTE",
        "DCC",
        "DFR",
        "IDR",
        "DIA",
        "DAC",
        "SVC"
      ],
      "status": "planned",
      "products": [
        {
          "name": "VCkit",
          "url": "https://github.com/uncefact/project-vckit",
          "description": "Verifiable credential issuing and verifying toolkit.",
          "untpScope": ["VCP"],
          "untpVersions": ["all"],
          "testResults": []
        },
        {
          "name": "Test Kit",
          "url": "https://uncefact.github.io/tests-untp/",
          "description": "A suite of conformity testing tools for all UNTP specifications.",
          "untpScope": ["DPP", "DCC", "DFR", "DTE", "DIA"],
          "untpVersions": ["all"],
          "testResults": []
        }
      ],
      "industryFocus": []
    },
    {
      "id": "https://untp.unece.org/registers/swi/spherity",
      "name": "Spherity",
      "website": "https://www.spherity.com/",
      "description": "Spherity is a global leader in digital identity solutions, focused on improving secure identity management for enterprises, products, and supply chains. Supporting UNTP implementation aligns with our mission to enhance transparency, accountability, and trust.",
      "registrationCountry": "Germany",
      "operatingCountries": "Global",
      "commitmentDate": "2024-09-11",
      "pilotParticipation": false,
      "untpScope": [
        "VCP",
        "DPP",
        "DTE",
        "DCC",
        "DFR",
        "IDR",
        "DIA",
        "DAC",
        "SVC"
      ],
      "status": "planned",
      "products": [
        {
          "name": "VERA",
          "url": "https://vera.spherity.com/",
          "description": "Digital Product Passport Suite.",
          "untpScope": ["VCP", "DPP", "DTE", "DFR", "IDR", "DAC"],
          "untpVersions": ["1.0"],
          "testResults": []
        }
      ],
      "industryFocus": []
    },
    {
      "id": "https://untp.unece.org/registers/swi/trust-provenance",
      "name": "Trust Provenance",
      "website": "https://trustprovenance.com/",
      "description": "Trust Provenance focuses on ensuring trust and integrity in supply chains, particularly in Australian agriculture, by leveraging UNTP to manage digital product passports with credible, traceable, and verifiable data.",
      "registrationCountry": "Australia",
      "operatingCountries": "Global",
      "commitmentDate": "2024-09-11",
      "pilotParticipation": true,
      "untpScope": [
        "VCP",
        "DPP",
        "DTE",
        "DCC",
        "DFR",
        "IDR",
        "DIA",
        "DAC",
        "SVC"
      ],
      "status": "planned",
      "products": [
        {
          "name": "Trust Provenance",
          "url": "https://trustprovenance.com/",
          "description": "Supply chain traceability and transparency suite.",
          "untpScope": ["VCP", "DPP", "DTE", "DFR", "IDR", "DAC"],
          "untpVersions": ["all"],
          "testResults": []
        }
      ],
      "industryFocus": []
    },
    {
      "id": "https://untp.unece.org/registers/swi/tilkal",
      "name": "Tilkal",
      "website": "https://www.tilkal.com",
      "description": "Tilkal is a premier platform for supply chain traceability and transparency, integrating a B2B blockchain network with advanced analytics and risk scoring algorithms to deliver a secure, real-time view of the end-to-end supply chain.",
      "registrationCountry": "France",
      "operatingCountries": "Global",
      "commitmentDate": "2024-09-12",
      "pilotParticipation": true,
      "untpScope": ["VCP", "DPP", "DCC"],
      "status": "planned",
      "products": [
        {
          "name": "Tilkal Platform",
          "url": "https://www.tilkal.com",
          "description": "Supply chain traceability and transparency suite.",
          "untpScope": ["VCP", "DPP"],
          "untpVersions": ["0.5", "1.0"],
          "testResults": []
        }
      ],
      "industryFocus": []
    },
    {
      "id": "https://untp.unece.org/registers/swi/northern-block",
      "name": "Northern Block",
      "website": "https://northernblock.io/",
      "description": "Northern Block's enterprise digital credentialing product enables the mining industry to exchange verifiable sustainability data based on industry standards such as Towards Sustainable Mining.",
      "registrationCountry": "Canada",
      "operatingCountries": "Canada",
      "commitmentDate": "2024-09-12",
      "pilotParticipation": true,
      "untpScope": ["VCP", "DCC"],
      "status": "planned",
      "products": [
        {
          "name": "Orbit Enterprise",
          "url": "https://northernblock.io/orbit-enterprise",
          "description": "Enterprise Self-Sovereign Identity.",
          "untpScope": ["VCP", "DCC"],
          "untpVersions": ["0.5", "1.0"],
          "testResults": []
        },
        {
          "name": "Trust Registry",
          "url": "https://trustregistry.nborbit.ca/",
          "description": "Enterprise Trust Registry.",
          "untpScope": ["DCC"],
          "untpVersions": ["0.5", "1.0"],
          "testResults": []
        }
      ],
      "industryFocus": [
        {
          "industrySector": "Mining",
          "processFocus": "Towards Sustainable Mining, The Copper Mark",
          "untpUsage": ["DCC"]
        }
      ]
    },
    {
      "id": "https://untp.unece.org/registers/swi/freshchain",
      "name": "FreshChain",
      "website": "https://freshchain.com.au/",
      "description": "FreshChain is a fully integrated, blockchain enabled, paddock to plate assurance system that verifies the food you eat. UNTP is an important implementable standard for FreshChain to empower customers to connect into global transparent and sustainable supply chains.",
      "registrationCountry": "Australia",
      "operatingCountries": "Global",
      "commitmentDate": "2024-09-12",
      "pilotParticipation": true,
      "untpScope": ["VCP", "DPP", "DFR", "DTE", "DCC", "IDR", "DAC"],
      "status": "planned",
      "products": [
        {
          "name": "FreshChain Platform",
          "url": "https://freshchain.com.au/",
          "description": "Traceability from farm to fork.",
          "untpScope": ["VCP", "DPP", "DCC", "DTE", "IDR", "DIA", "DAC"],
          "untpVersions": ["0.5", "1.0"],
          "testResults": []
        }
      ],
      "industryFocus": [
        {
          "industrySector": "Agriculture",
          "processFocus": "Horticulture food safety, export compliance",
          "untpUsage": ["DPP", "DCC"]
        }
      ]
    },
    {
      "id": "https://untp.unece.org/registers/swi/gov-bc",
      "name": "Government of British Columbia",
      "website": "https://digital.gov.bc.ca",
      "description": "The BC government sees UNTP implementation as an opportunity to enable BC producers of raw materials to differentiate their products in emerging sustainability-focused markets.",
      "registrationCountry": "Canada",
      "operatingCountries": "Global",
      "commitmentDate": "2024-09-12",
      "pilotParticipation": true,
      "untpScope": ["VCP", "DCC", "DIA"],
      "status": "planned",
      "products": [
        {
          "name": "Traction",
          "url": "https://digital.gov.bc.ca/digital-trust/tools/traction/",
          "description": "A tool for simplifying the sending and receiving of digital credentials for governments and organisations.",
          "untpScope": ["VCP", "DPP", "DCC"],
          "untpVersions": ["0.5", "1.0"],
          "testResults": []
        }
      ],
      "industryFocus": [
        {
          "industrySector": "Government",
          "processFocus": "Compliance (permits, licenses, certificates)",
          "untpUsage": ["VCP", "DPP", "DCC"]
        }
      ]
    },
    {
      "id": "https://untp.unece.org/registers/swi/relog3p",
      "name": "ReLOG3P SRL",
      "website": "https://relog3p.com/",
      "description": "ReLOG3P is an Innovative Startup and Benefit Corporation based in Italy, supporting Global Trade to achieve the UN Agenda 2030 and EU Green Deal objectives through full supply chain transparency.",
      "registrationCountry": "Italy",
      "operatingCountries": "Global",
      "commitmentDate": "2024-09-12",
      "pilotParticipation": true,
      "untpScope": ["VCP", "DPP", "DTE", "IDR", "DIA", "DAC", "SVC"],
      "status": "planned",
      "products": [
        {
          "name": "ReACT",
          "description": "Reshaping transport and logistics towards a sustainable future.",
          "untpScope": ["VCP", "DPP", "DTE"],
          "untpVersions": ["0.5", "1.0"],
          "testResults": []
        },
        {
          "name": "SRL",
          "description": "Digital credential issuance and management platform.",
          "untpScope": ["VCP", "DPP", "DTE"],